{
  "page": {
    "height": "297mm",
    "width": "210mm",
    "top": "20mm",
    "outside": "20mm",
    "bottom": "20mm",
    "inside": "20mm"
  },
  "header": {
    "odd": ["title"],
    "even": ["title"]
  },
  "footer": {
    "odd": ["folio"],
    "even": ["folio"]
  },
  "style": {
    "body": {
      "background-color": "transparent",
      "padding-top": "0pt",
      "padding-right": "0pt",
      "padding-bottom": "0pt",
      "padding-left": "0pt",
      "end-indent": "0pt",
      "border-before-style": "none",
      "border-before-width": "1pt",
      "border-before-color": "black",
      "border-end-style": "none",
      "border-end-width": "1pt",
      "border-end-color": "black",
      "border-after-style": "none",
      "border-after-width": "1pt",
      "border-after-color": "black",
      "border-start-style": "none",
      "border-start-width": "1pt",
      "border-start-color": "black",
      "font-family": "Times New Roman",
      "font-size": "10pt",
      "color": "black",
      "font-weight": "normal",
      "font-style": "normal",
      "text-decoration": "none",
      "space-before": "6pt",
      "space-after": "6pt",
      "text-align": "start",
      "start-indent": "25pt",
      "line-height": "1.2"
    },
    "topic": {
      "background-color": "transparent",
      "padding-top": "0pt",
      "padding-right": "0pt",
      "padding-bottom": "0pt",
      "padding-left": "0pt",
      "end-indent": "0pt",
      "border-before-style": "none",
      "border-before-width": "1pt",
      "border-before-color": "black",
      "border-end-style": "none",
      "border-end-width": "1pt",
      "border-end-color": "black",
      "border-after-style": "none",
      "border-after-width": "1pt",
      "border-after-color": "black",
      "border-start-style": "none",
      "border-start-width": "1pt",
      "border-start-color": "black",
      "font-family": "Helvetica",
      "font-size": "18pt",
      "color": "black",
      "font-weight": "bold",
      "font-style": "normal",
      "text-decoration": "none",
      "space-before": "0pt",
      "space-after": "16.8pt",
      "text-align": "start",
      "start-indent": "0pt",
      "line-height": "1.2",
      "title-numbering": true
    },
    "topic_topic": {
      "background-color": "transparent",
      "padding-top": "0pt",
      "padding-right": "0pt",
      "padding-bottom": "0pt",
      "padding-left": "0pt",
      "end-indent": "0pt",
      "border-before-style": "none",
      "border-before-width": "1pt",
      "border-before-color": "black",
      "border-end-style": "none",
      "border-end-width": "1pt",
      "border-end-color": "black",
      "border-after-style": "none",
      "border-after-width": "1pt",
      "border-after-color": "black",
      "border-start-style": "none",
      "border-start-width": "1pt",
      "border-start-color": "black",
      "font-family": "Helvetica",
      "font-size": "14pt",
      "color": "black",
      "font-weight": "bold",
      "font-style": "normal",
      "text-decoration": "none",
      "space-before": "12pt",
      "space-after": "5pt",
      "text-align": "start",
      "start-indent": "0pt",
      "line-height": "1.2",
      "title-numbering": true
    },
    "topic_topic_topic": {
      "background-color": "transparent",
      "padding-top": "0pt",
      "padding-right": "0pt",
      "padding-bottom": "0pt",
      "padding-left": "0pt",
      "end-indent": "0pt",
      "border-before-style": "none",
      "border-before-width": "1pt",
      "border-before-color": "black",
      "border-end-style": "none",
      "border-end-width": "1pt",
      "border-end-color": "black",
      "border-after-style": "none",
      "border-after-width": "1pt",
      "border-after-color": "black",
      "border-start-style": "none",
      "border-start-width": "1pt",
      "border-start-color": "black",
      "font-family": "Helvetica",
      "font-size": "12pt",
      "color": "black",
      "font-weight": "bold",
      "font-style": "normal",
      "text-decoration": "none",
      "space-before": "12pt",
      "space-after": "2pt",
      "text-align": "start",
      "start-indent": "0pt",
      "line-height": "1.2",
      "title-numbering": true
    },
    "topic_topic_topic_topic": {
      "background-color": "transparent",
      "padding-top": "0pt",
      "padding-right": "0pt",
      "padding-bottom": "0pt",
      "padding-left": "0pt",
      "end-indent": "0pt",
      "border-before-style": "none",
      "border-before-width": "1pt",
      "border-before-color": "black",
      "border-end-style": "none",
      "border-end-width": "1pt",
      "border-end-color": "black",
      "border-after-style": "none",
      "border-after-width": "1pt",
      "border-after-color": "black",
      "border-start-style": "none",
      "border-start-width": "1pt",
      "border-start-color": "black",
      "font-family": "Helvetica",
      "font-size": "10pt",
      "color": "black",
      "font-weight": "bold",
      "font-style": "normal",
      "text-decoration": "none",
      "space-before": "12pt",
      "space-after": "0pt",
      "text-align": "start",
      "start-indent": "0pt",
      "line-height": "1.2",
      "title-numbering": true
    },
    "section": {
      "background-color": "transparent",
      "padding-top": "0pt",
      "padding-right": "0pt",
      "padding-bottom": "0pt",
      "padding-left": "0pt",
      "end-indent": "0pt",
      "border-before-style": "none",
      "border-before-width": "1pt",
      "border-before-color": "black",
      "border-end-style": "none",
      "border-end-width": "1pt",
      "border-end-color": "black",
      "border-after-style": "none",
      "border-after-width": "1pt",
      "border-after-color": "black",
      "border-start-style": "none",
      "border-start-width": "1pt",
      "border-start-color": "black",
      "font-family": "Helvetica",
      "font-size": "10pt",
      "color": "black",
      "font-weight": "bold",
      "font-style": "normal",
      "text-decoration": "none",
      "space-before": "6pt",
      "space-after": "6pt",
      "text-align": "start",
      "start-indent": "25pt",
      "line-height": "1.2"
    },
    "example": {
      "background-color": "transparent",
      "padding-top": "0pt",
      "padding-right": "0pt",
      "padding-bottom": "0pt",
      "padding-left": "0pt",
      "end-indent": "0pt",
      "border-before-style": "none",
      "border-before-width": "1pt",
      "border-before-color": "black",
      "border-end-style": "none",
      "border-end-width": "1pt",
      "border-end-color": "black",
      "border-after-style": "none",
      "border-after-width": "1pt",
      "border-after-color": "black",
      "border-start-style": "none",
      "border-start-width": "1pt",
      "border-start-color": "black",
      "font-family": "Times New Roman",
      "font-size": "10pt",
      "color": "black",
      "font-weight": "normal",
      "font-style": "normal",
      "text-decoration": "none",
      "space-before": "6pt",
      "space-after": "6pt",
      "text-align": "start",
      "start-indent": "25pt",
      "line-height": "1.2"
    },
    "example_title": {
      "background-color": "transparent",
      "padding-top": "0pt",
      "padding-right": "0pt",
      "padding-bottom": "0pt",
      "padding-left": "0pt",
      "end-indent": "0pt",
      "border-before-style": "none",
      "border-before-width": "1pt",
      "border-before-color": "black",
      "border-end-style": "none",
      "border-end-width": "1pt",
      "border-end-color": "black",
      "border-after-style": "none",
      "border-after-width": "1pt",
      "border-after-color": "black",
      "border-start-style": "none",
      "border-start-width": "1pt",
      "border-start-color": "black",
      "font-family": "Helvetica",
      "font-size": "10pt",
      "color": "black",
      "font-weight": "bold",
      "font-style": "normal",
      "text-decoration": "none",
      "space-before": "6pt",
      "space-after": "6pt",
      "text-align": "start",
      "start-indent": "25pt",
      "line-height": "1.2"
    },
    "note": {
      "background-color": "transparent",
      "padding-top": "0pt",
      "padding-right": "0pt",
      "padding-bottom": "0pt",
      "padding-left": "0pt",
      "end-indent": "0pt",
      "border-before-style": "none",
      "border-before-width": "1pt",
      "border-before-color": "black",
      "border-end-style": "none",
      "border-end-width": "1pt",
      "border-end-color": "black",
      "border-after-style": "none",
      "border-after-width": "1pt",
      "border-after-color": "black",
      "border-start-style": "none",
      "border-start-width": "1pt",
      "border-start-color": "black",
      "font-family": "Times New Roman",
      "font-size": "10pt",
      "color": "black",
      "font-weight": "normal",
      "font-style": "normal",
      "text-decoration": "none",
      "space-before": "6pt",
      "space-after": "6pt",
      "text-align": "start",
      "start-indent": "25pt",
      "line-height": "1.2"
    },
    "pre": {
      "background-color": "transparent",
      "padding-top": "0pt",
      "padding-right": "0pt",
      "padding-bottom": "0pt",
      "padding-left": "0pt",
      "end-indent": "0pt",
      "border-before-style": "none",
      "border-before-width": "1pt",
      "border-before-color": "black",
      "border-end-style": "none",
      "border-end-width": "1pt",
      "border-end-color": "black",
      "border-after-style": "none",
      "border-after-width": "1pt",
      "border-after-color": "black",
      "border-start-style": "none",
      "border-start-width": "1pt",
      "border-start-color": "black",
      "font-family": "Courier New",
      "font-size": "10pt",
      "color": "black",
      "font-weight": "normal",
      "font-style": "normal",
      "text-decoration": "none",
      "space-before": "15pt",
      "space-after": "6pt",
      "text-align": "start",